{
  "format": "sdl-release-manifest/v1",
  "id": "sdl-v2.0-draft.1",
  "languageVersion": "2.0",
  "status": "draft",
  "published": "2026-09-12",
  "authority": [
    {
      "path": "spec/v2/FULL-SPEC.md",
      "role": "normative-prose",
      "precedence": 1,
      "sha256": "f7808646f639ebfbcf08722331d3c51bc5f6a0899de602063c1675f19985b46d"
    },
    {
      "path": "spec/v2/FOUNDATIONS.md",
      "role": "normative-prose",
      "precedence": 2,
      "sha256": "5892d571739b98c65ca62de0a49a0624fd494f9efca36189c9d2ba3f4bbcc795"
    },
    {
      "path": "spec/v2/OWNERSHIP-BINDINGS.md",
      "role": "normative-prose",
      "precedence": 3,
      "sha256": "e5e43960c42056cdad0ba1b65af600f4ac265a9d0bcfd51917368c03382ad62c"
    },
    {
      "path": "spec/v2/CONTRACTS-ERRORS.md",
      "role": "normative-prose",
      "precedence": 4,
      "sha256": "d728a847707bdd5ee3248fa6c2fbbbf51bf5688bf13ae0d0da9c73128ce0bfb6"
    },
    {
      "path": "spec/v2/DOMAIN-METADATA.md",
      "role": "normative-prose",
      "precedence": 5,
      "sha256": "f64b4e0081175165e70b79a97dbbb2353ca9b72d05ef3d28091e021c286629c4"
    },
    {
      "path": "spec/v2/SCOPE-OPERATIONS.md",
      "role": "normative-prose",
      "precedence": 6,
      "sha256": "be0a85573a54acc6342484b372e6a1e5af5fdc9afa6ddc0ba708bd880f3598c2"
    },
    {
      "path": "spec/v2/NORMALIZATION.md",
      "role": "normative-prose",
      "precedence": 7,
      "sha256": "bada72b7b9771ef783b09e7bbbc40930c8ab75c632b8f16db11a15d8bb452bbe"
    },
    {
      "path": "spec/v2/DIAGNOSTICS.md",
      "role": "normative-prose",
      "precedence": 8,
      "sha256": "3ace1e3850310b432eaecc75b252438faf9c47f26c92115e464f50c3935cc11a"
    },
    {
      "path": "spec/v2/RELEASE-MIGRATION.md",
      "role": "normative-prose",
      "precedence": 9,
      "sha256": "4dd5cd97405a161565e5723ef033eab597267dc7860da7d3c79489c1efc738e6"
    },
    {
      "path": "spec/v2/sdl-v2.schema.json",
      "role": "structural-schema",
      "precedence": 10,
      "sha256": "adbceda862dd919879f9e6f58c6ae1be7efad27807fc624e24a319e8bc7f89f6"
    },
    {
      "path": "spec/v2/diagnostics.schema.json",
      "role": "structural-schema",
      "precedence": 11,
      "sha256": "4eac9315456ebfb5a649ea9abd174911f2546e09bfc937711771c4ea2f795713"
    },
    {
      "path": "spec/v2/release-manifest.schema.json",
      "role": "structural-schema",
      "precedence": 12,
      "sha256": "7ea1093d28b39ec6ad503bd3d037ee233da578f740b4e5b5f6058c89e460794c"
    },
    {
      "path": "spec/v2/migration.schema.json",
      "role": "structural-schema",
      "precedence": 13,
      "sha256": "8a409c40322dbd694b15bfaddd884a3c345f396ebdb8200782b9a9ebdbec2c36"
    },
    {
      "path": "spec/v2/migrations/v1.1-to-v2.0-draft.1.json",
      "role": "normative-corpus",
      "precedence": 14,
      "sha256": "2d461768b2ffc7739a2cb0facc89691394f2edaa84c56e37b0f53b0576b7228c"
    },
    {
      "path": "spec/v2/conformance/cases.yaml",
      "role": "normative-corpus",
      "precedence": 15,
      "sha256": "ae700f5df2f4b14d5ff8909652b0fb7b5fdbcb4414cd41f4b05716294f3c7e60"
    },
    {
      "path": "spec/v2/conformance/bindings.yaml",
      "role": "normative-corpus",
      "precedence": 16,
      "sha256": "d2b367cf866007244dbfc829701e4b5ce87a362cfa3eed73690eb5acd1a219b0"
    },
    {
      "path": "spec/v2/conformance/contracts.yaml",
      "role": "normative-corpus",
      "precedence": 17,
      "sha256": "e2d326d854f7bcb215e4ff7298625459a5db308077486c72a68d7d0d4b3f451a"
    },
    {
      "path": "spec/v2/conformance/domain-metadata.yaml",
      "role": "normative-corpus",
      "precedence": 18,
      "sha256": "684eb8eef2ee210f5a8a6c1dd37b4d7da36fa06635e62e7128436c939e784779"
    },
    {
      "path": "spec/v2/conformance/scope-operations.yaml",
      "role": "normative-corpus",
      "precedence": 19,
      "sha256": "01c741121ca6fdefa384cf3739361c3feea62b9a99349372191e7576d15352d4"
    },
    {
      "path": "spec/v2/conformance/normalization.yaml",
      "role": "normative-corpus",
      "precedence": 20,
      "sha256": "579cab0b0d4071ebe1d4a9ce854c0e03e43df1cf276c95da1466c531cd8e186b"
    },
    {
      "path": "spec/v2/conformance/full-document.yaml",
      "role": "normative-corpus",
      "precedence": 21,
      "sha256": "375eda58d3092d8e36669d4ebb9b664f0452e3f289f29fa637a92649193052ea"
    },
    {
      "path": "spec/v2/conformance/diagnostics.yaml",
      "role": "normative-corpus",
      "precedence": 22,
      "sha256": "ea06d7cab5eb27dd5bb3de42976f6f1c25d222eedc8d76193436eec939ad2979"
    },
    {
      "path": "spec/v2/conformance/release-migration.yaml",
      "role": "normative-corpus",
      "precedence": 23,
      "sha256": "f021c650a3cb4f3dead085a2e807c5953272418dd7ae5b2bc16932b8a1027672"
    },
    {
      "path": "spec/v2/FIELD-CATALOGUE.md",
      "role": "derived-reference",
      "precedence": 24,
      "sha256": "ead91d040edac48c5934d101ae8e7ea769f83a4fa5121a1f38abbcd42d36975d"
    },
    {
      "path": "spec/v2/RULE-COVERAGE.md",
      "role": "derived-reference",
      "precedence": 25,
      "sha256": "870ba08ca731c6c5efc292ec3af465e7a562baf0e61c283ad94b81771044e32f"
    }
  ],
  "notes": "First complete portable v2 specification draft. Stable promotion and package conformance are separate future work."
}
