{
  "format": "sdl-release-manifest/v1",
  "id": "sdl-v2.0",
  "languageVersion": "2.0",
  "status": "active",
  "published": "2026-09-12",
  "authority": [
    {
      "path": "spec/v2/FULL-SPEC.md",
      "role": "normative-prose",
      "precedence": 1,
      "sha256": "85a7cd69f0b20da0d72502d6c083783bcda99c97ed54a2e9b43785bc7cd9ac69"
    },
    {
      "path": "spec/v2/FOUNDATIONS.md",
      "role": "normative-prose",
      "precedence": 2,
      "sha256": "b4b632204ff63e9cc155f1a77147a65766408e5585c04c745ffe0a2887803462"
    },
    {
      "path": "spec/v2/OWNERSHIP-BINDINGS.md",
      "role": "normative-prose",
      "precedence": 3,
      "sha256": "c047cb167e167b5aed352c499779f8fc3f32a42635490ec34e8df0ca98337836"
    },
    {
      "path": "spec/v2/CONTRACTS-ERRORS.md",
      "role": "normative-prose",
      "precedence": 4,
      "sha256": "7ba4eb2f3c1b20f8b7440f0c79c46e5118e38917d49715780bb3fe81196ad1fb"
    },
    {
      "path": "spec/v2/DOMAIN-METADATA.md",
      "role": "normative-prose",
      "precedence": 5,
      "sha256": "97c5d091b916f933ac4f86715f83452a03a4c3bfbb2cbcb5f9e41bd51ca353a5"
    },
    {
      "path": "spec/v2/SCOPE-OPERATIONS.md",
      "role": "normative-prose",
      "precedence": 6,
      "sha256": "de0be2594ae9ab10bb1e92deb5e89ed68952980b3e32077e41bafc8b03af64c6"
    },
    {
      "path": "spec/v2/NORMALIZATION.md",
      "role": "normative-prose",
      "precedence": 7,
      "sha256": "ced8f6e05d2136ced126a9c00d8c6a875bd3449b065b8f1f1bd9a2d58746a759"
    },
    {
      "path": "spec/v2/DIAGNOSTICS.md",
      "role": "normative-prose",
      "precedence": 8,
      "sha256": "0ac923a5f2365ea458bdaf196d18867dc8a1f25b3d1ece7c5654d7706422c8cb"
    },
    {
      "path": "spec/v2/RELEASE-MIGRATION.md",
      "role": "normative-prose",
      "precedence": 9,
      "sha256": "2f36b48ec7c031900122188386c79fb9d560d25fe99172716bdf2e3a9631f8e0"
    },
    {
      "path": "spec/v2/sdl-v2.schema.json",
      "role": "structural-schema",
      "precedence": 10,
      "sha256": "adbceda862dd919879f9e6f58c6ae1be7efad27807fc624e24a319e8bc7f89f6"
    },
    {
      "path": "spec/v2/diagnostics.schema.json",
      "role": "structural-schema",
      "precedence": 11,
      "sha256": "4eac9315456ebfb5a649ea9abd174911f2546e09bfc937711771c4ea2f795713"
    },
    {
      "path": "spec/v2/release-manifest.schema.json",
      "role": "structural-schema",
      "precedence": 12,
      "sha256": "7ea1093d28b39ec6ad503bd3d037ee233da578f740b4e5b5f6058c89e460794c"
    },
    {
      "path": "spec/v2/migration.schema.json",
      "role": "structural-schema",
      "precedence": 13,
      "sha256": "8a409c40322dbd694b15bfaddd884a3c345f396ebdb8200782b9a9ebdbec2c36"
    },
    {
      "path": "spec/v2/migrations/v1.1-to-v2.0.json",
      "role": "normative-corpus",
      "precedence": 14,
      "sha256": "340a93087577f43bdd25bc17d4784020b4bb7321f27a5627f778c76e3d94533d"
    },
    {
      "path": "spec/v2/conformance/cases.yaml",
      "role": "normative-corpus",
      "precedence": 15,
      "sha256": "6415f2f38a2520cd6cc44b29885a8fff1a7cf7e88f1c291d0a7297e81f31f6e6"
    },
    {
      "path": "spec/v2/conformance/bindings.yaml",
      "role": "normative-corpus",
      "precedence": 16,
      "sha256": "dcc438606185a0fc11b11b7d25f4c812eef501a94a80d04fc76932e929480cbd"
    },
    {
      "path": "spec/v2/conformance/contracts.yaml",
      "role": "normative-corpus",
      "precedence": 17,
      "sha256": "dbd38ebe04f02bc82f8daf86dd977ed7939a5c923b6164a3f4a9134f1a4ec84a"
    },
    {
      "path": "spec/v2/conformance/domain-metadata.yaml",
      "role": "normative-corpus",
      "precedence": 18,
      "sha256": "97a036db6d8ff273ea00546437937538d5afebdad01a988bfb38ce77d66a2263"
    },
    {
      "path": "spec/v2/conformance/scope-operations.yaml",
      "role": "normative-corpus",
      "precedence": 19,
      "sha256": "d4f10bf3996cd02e3038f5f5f1e734a7d67a5347aa18b4804399f9e5e7677818"
    },
    {
      "path": "spec/v2/conformance/normalization.yaml",
      "role": "normative-corpus",
      "precedence": 20,
      "sha256": "37bde4521c647a84eeb318e34971560861c210e91427d7e6991629da976661c1"
    },
    {
      "path": "spec/v2/conformance/full-document.yaml",
      "role": "normative-corpus",
      "precedence": 21,
      "sha256": "8cd3678ca922da85a8237aec5887e8df96b3a044e9405a6360cc4f0d7586dbb3"
    },
    {
      "path": "spec/v2/conformance/diagnostics.yaml",
      "role": "normative-corpus",
      "precedence": 22,
      "sha256": "c79b27c1139d95140b07ee83f2a41248d1736c063ad61e7e5fbf9befd0f987b8"
    },
    {
      "path": "spec/v2/conformance/release-migration.yaml",
      "role": "normative-corpus",
      "precedence": 23,
      "sha256": "b47a2d128b1b76fb283c3b447ad2f1c87b3143cfb8b58affebacbf1f8db26113"
    },
    {
      "path": "spec/v2/FIELD-CATALOGUE.md",
      "role": "derived-reference",
      "precedence": 24,
      "sha256": "841122077a19b7c523743526adc6649331cb4da1aee862bd64d6d5f3a1af6dab"
    },
    {
      "path": "spec/v2/RULE-COVERAGE.md",
      "role": "derived-reference",
      "precedence": 25,
      "sha256": "24f0429c8e32d6dd40913c8db282bbeecb257ba676a4f4999b0b8381ffcf9d56"
    }
  ],
  "notes": "Active v2 specification baseline for the 2.x line, promoted from the preceding numbered draft record after review of the compatibility inventory. SDL v1.1 remains active for the 1.x line; package implementation of v2 is separate work."
}
